<?xml version="1.0" encoding="UTF-8"?>
<animais xmlns:xsi="http://www.w3.org/2001/XMLSchema-instance"
         xsi:noNamespaceSchemaLocation="animal_schema.xsd">

    <animal>
        <nome>Gato</nome>
        <especie>Felis catus</especie>
        <idade>5</idade>
    </animal>

    <animal>
        <nome>Cachorro</nome>
        <especie>Canis lupus familiaris</especie>
        <idade>3</idade>
    </animal>

    <animal>
        <nome>PÃ¡ssaro</nome>
        <especie>Aves</especie>
        <idade>1</idade>
    </animal>

</animais>
